{
  "$schema": "https://json-schema.org/draft/2020-12/schema",
  "$id": "comity:adr-008-core-exception-register.schema.json",
  "title": "ADR-008 Core-to-Core Dependency Exception Register",
  "description": "Machine-readable serialization of the ADR-008 closed register of Core-to-Core dependency exceptions. ADR-008 (Markdown) remains the architectural authority; this register is a derived representation and MUST NOT redefine architecture.",
  "type": "object",
  "additionalProperties": false,
  "required": ["$schema", "schemaVersion", "authority", "source", "edges"],
  "properties": {
    "$schema": {
      "const": "comity:adr-008-core-exception-register.schema.json"
    },
    "schemaVersion": {
      "type": "integer",
      "const": 1,
      "description": "Version of the register schema. Incremented when the data contract changes in a breaking way."
    },
    "authority": {
      "const": "ADR-008",
      "description": "The architectural authority this register serializes."
    },
    "source": {
      "const": "docs/standards/decisions/ADR-008-explicit-core-module-composition-exceptions.md",
      "description": "Path to the authoritative ADR document."
    },
    "edges": {
      "type": "array",
      "description": "Closed list of approved Core-to-Core dependency exceptions.",
      "items": {
        "$ref": "#/$defs/dependencyEdge"
      },
      "uniqueItems": true
    }
  },
  "$defs": {
    "dependencyEdge": {
      "type": "object",
      "additionalProperties": false,
      "required": [
        "from",
        "to",
        "layer",
        "categories",
        "importKind",
        "lifecycle",
        "justification",
        "adrReference"
      ],
      "properties": {
        "from": {
          "type": "string",
          "pattern": "^@comity/[a-z0-9-]+$",
          "description": "Source package name."
        },
        "to": {
          "type": "string",
          "pattern": "^@comity/[a-z0-9-]+$",
          "description": "Target package name."
        },
        "layer": {
          "const": "core-to-core",
          "description": "Layer relationship. This register covers only Core-to-Core edges."
        },
        "categories": {
          "type": "array",
          "minItems": 1,
          "uniqueItems": true,
          "items": {
            "type": "string",
            "enum": ["capability", "infrastructure-contract", "value-import", "candidate-for-removal"]
          },
          "description": "All classifications that apply to this edge. A single edge may belong to multiple classifications (e.g., storefront -> catalog is both a capability exception and a value-import exception). This is the sole classification field."
        },
        "importKind": {
          "type": "string",
          "enum": ["type-only", "value", "mixed"],
          "description": "Whether the dependency is type-only, value, or a mix of both."
        },
        "lifecycle": {
          "type": "string",
          "enum": ["approved", "deprecated", "migration-candidate"],
          "description": "Lifecycle status: approved exception, deprecated pattern tracked for removal, or scheduled migration candidate."
        },
        "justification": {
          "type": "string",
          "minLength": 1,
          "description": "Justification as recorded in ADR-008."
        },
        "adrReference": {
          "type": "string",
          "minLength": 1,
          "description": "Reference back to ADR-008, including the specific register section/table where practical."
        },
        "removalCandidate": {
          "type": "object",
          "additionalProperties": false,
          "required": ["criteria", "action"],
          "description": "Removal candidate tracking, mirroring ADR-008 'Candidates for Removal'. Required when lifecycle is 'migration-candidate'.",
          "properties": {
            "criteria": {
              "type": "string",
              "description": "The ADR-008 acceptance criteria this dependency fails."
            },
            "action": {
              "type": "string",
              "description": "The migration action required to remove or refactor the dependency."
            }
          }
        }
      },
      "if": {
        "properties": {
          "lifecycle": {
            "const": "migration-candidate"
          }
        },
        "required": ["lifecycle"]
      },
      "then": {
        "required": ["removalCandidate"]
      }
    }
  }
}
